[
  {
    "title": "Tour Te Waipounamu 2026",
    "body": "Bikes of Tour Te Waipounamu 2026\n22 January, 2026\nPowered By:\nRufus Wenlock\nAge\n: 38\nLocation\n: NZ\nBike\n: Süfur - prototype 32”\nKey items of kit\n: Massive frame bag made by Tailfin. This has all my clothing, sleep system and food.\nAlbion cargo vest with 2lt water + snacks + spares.\nTailfin top tube bag with all my electronics.\n750ml bottle on top tube.\nFrame type\n: Hardtail - Front Suspension\nFrame material\n: Steel\nWheel size\n: Other\nTyre width\n: 50mm+\nElectronic shifting\n: Yes\nSami Sauri\nAge\n: 33\nLocation\n: chamonix\nBike\n: Frame : Rose bikes - PDQ hard tail\nWheels: Zipp 1ZERO HITOP SW\nDrivetrain:\nCrankset: Sram XX SL Eagle 32 chainring\nCassette: Sram XX SL Eagle10-52\nRear derailleur: Sram XX SL Eagle TType\nKey items of kit\n: Controllers: Pod Ultimate controler\nHandlebar: flat bar + aero zipp handlebars\nSaddle: Selle San Marco Shortfit 2.0 Supercomfort\nTires: Schwalbe Racing Ralph and Racing Ray 2.35”\nPedals: Time pedals\nHammerhead device\nLight front Supernova B54 pro with battery (50+hours)\nRear light - can’t remember\nAll bags from Tailfin (white ones are custom made)\nFrame type\n: Hardtail - Front Suspension\nFrame material\n: Carbon\nWheel size\n: 700c (29\")\nTyre width\n: 50mm+\nElectronic shifting\n: Yes\nJade Saskia Simpson-Field\nAge\n: 34\nLocation\n: Leeds, UK\nBike\n: I'll be riding my Cube AMS One11 C:68 TM with a dropper, Son dynamo, k-lite front light and silly loop handlebars.\nKey items of kit\n: I've got my tent (Nemo Hornet Elite), sleeping bag (S2S Spark 3), mat (S2S) and PJs, as well as full water proofs and some extra warm layers. Loads of food. Hikeahike harness. Flat pedals and sandals. And NZ specifics - loads of suncream, spork for ice cream consumption and pineapple lumps!\nFrame type\n: MTB - Full Suspension\nFrame material\n: Carbon\nWheel size\n: 700c (29\")\nTyre width\n: 50mm+\nElectronic shifting\n: No\nAngus Young\nAge\n: 29\nLocation\n: Dorset, Uk\nBike\n: Yeti ASR with Hunt wheels\nKey items of kit\n: Restrap bags, exposure lights (loads of them), Precision fuel and hydration, Le Col clothing.\nFrame type\n: MTB - Full Suspension\nFrame material\n: Carbon\nWheel size\n: 700c (29\")\nTyre width\n: 50mm+\nElectronic shifting\n: Yes\nSam Horgan\nAge\n: 38\nLocation\n: Christchurch\nBike\n: BMC Two Stroke AL\nRock Shox SID + SRAM X01 AXS.\nProfile Aerobars, SQLabs Toggles.\nTailfin Aeropack + Revelate Frame Bag + Revelate Pitckfork.\nKey items of kit\n: MLD Bivy, Sea to Summit Sleeping Bag, Thermarest Neoair Sleeping Mat.\nFrame type\n: Hardtail - Front Suspension\nFrame material\n: Aluminium\nWheel size\n: 700c (29\")\nTyre width\n: 50mm+\nElectronic shifting\n: Yes\nJak Brightwell\nAge\n: 24\nLocation\n: Wellington\nBike\n: I’ll be riding the 2018 Specialized Epic Hardtail I stole from my mum! It’s running a $17 carbon dynamo wheel I got from TradeMe hooked up to Supernova lights, Salsa bend bars with carbon aerobars, Ergon touch points (grips, saddle, and squishy seatpost), SRAM 12 speed drivetrain and new 2-pot Shimano brakes.\nKey items of kit\n: DansBagsTM has gone all in with a custom roll-top frame bag and stretchy top tube bag. The rear bag is held on with a Wayward riders Louise harness, and a Revelate Pronghorn up front. I’ll also be wearing a Restrap vest for extra bits. For hydration I’ve got a StudioForecast double bottle cage mount, and I’ll be navigating using a Coros Dura.\nFrame type\n: Hardtail - Front Suspension\nFrame material\n: Carbon\nWheel size\n: 700c (29\")\nTyre width\n: 50mm+\nElectronic shifting\n: No\nSam Snowden\nAge\n: 34\nLocation\n: Te Whanganui-a-Tara / Wellington\nBike\n: Yeti ASR\nKey items of kit\n: Sleep - Sea to Summit Spark / Sol Escape Bivi\nWarm - OR Synthetic\nEat - Everything\nFrame type\n: MTB - Full Suspension\nFrame material\n: Carbon\nWheel size\n: 700c (29\")\nTyre width\n: 50mm+\nElectronic shifting\n: No\nMike Norman\nAge\n: 57\nLocation\n: Cabarita Beach, Australia\nBike\n: Santa Cruz tall boy Dt Swiss carbon wheels, One Up dropper, Burgtec flat pedals, SRAM shifting n brakes.\nKey items of kit\n: Bike bag dude frame bag small bag front n rear. Sea to Summit sleeping bag, Fenix lights and Sol bivy.\nFrame type\n: MTB - Full Suspension\nFrame material\n: Carbon\nElectronic shifting\n: No\nBevan Collins\nAge\n: 51\nLocation\n: Kerikeri, Northland, NZ\nBike\n: Binary Bicycles SuperB XC, Shimano XTR components, kLite lights powered by a Son dynamo and 2.35 Mezcals.\nKey items of kit\n: Sea to Summit Traveller sleeping bag, Outdoor Research Helium Bivy, Paper Roads Aotearoa custom frame bag and Apidura bags and 2L hydration pack.\nFrame type\n: Hardtail - Front Suspension\nFrame material\n: Titanium\nWheel size\n: 700c (29\")\nTyre width\n: 50mm+\nElectronic shifting\n: Yes\nDean Ford\nAge\n: 47\nLocation\n: Wellington\nBike\n: Trek Superfly, SID 100mm forks, Wheelworks carbon wheels, Shimano XT 12-speed 30T x 10-51, Mezcal 2.35 tyres, closed-foam-taped-to-the-down-tube carry system.\nKey items of kit\n: Bivy, lightweight mat and sleeping bag, Fenix lights, lots of bag space for stocking up at resupply\nFrame type\n: Hardtail - Front Suspension\nFrame material\n: Carbon\nWheel size\n: 700c (29\")\nTyre width\n: 50mm+\nElectronic shifting\n: No\nLoic\nAge\n: 27\nCap number\n: 420\nLocation\n: Hobart . Australia\nBike\n: Santa Cruz Highball 27.5\nKey items of kit\n: Big custom top tube bag by Paul, frame bag collab with Mum, flat pedals\nRekon Race front and rear 2.35, TT bars, sleeping mat and emergency bivvy and DT Swiss EX471 Rim for chunk.\nFrame type\n: Hardtail - Front Suspension\nFrame material\n: Carbon\nWheel size\n: 650b (27.5\")\nTyre width\n: 50mm+\nElectronic shifting\n: No\nSimon Eglinton\nAge\n: 29\nLocation\n: Adelaide, South Australia\nBike\n: I'm riding a Santa Cruz Chameleon v7 with a 140mm fox 34 + transfer dropper. Groupset is a mix of 12 speed SLX and XT with 30/10-51 gearing and 4 piston stoppers. Tyres are 2.4 maxxis rekon race on sector carbon wheels. Stooge moto bars for the perfect backsweep and bucket loads of clamp area.\nKey items of kit\n: Nav is a coros dura. Bags are mostly revelate/miss grape il coso with a home made frame wedge, aerobar feedbag and hike-a-bike harness. Salomon 12 litre on the back. Lights are cleanskin with replaceable 18650s. Shoes are specialized recon 3.0 with the toe flex for comfy hiking. Sleep will be in an MLD bivvy, -1 bag and a cut out of closed cell foam. 3L water capacity.\nFrame type\n: Hardtail - Front Suspension\nFrame material\n: Aluminium\nWheel size\n: 700c (29\")\nTyre width\n: 50mm+\nElectronic shifting\n: No\nNick Edwards\nAge\n: 35\nLocation\n: Melbourne, Australia\nBike\n: Cervelo ZHT-5\nKey items of kit\n: Tailfin aero rack and bags , Exposure lights\nFrame type\n: Hardtail - Front Suspension\nFrame material\n: Carbon\nWheel size\n: 700c (29\")\nTyre width\n: 50mm+\nElectronic shifting\n: No\nDarryl Carpenter\nAge\n: 60\nLocation\n: Wellington\nBike\n: Trek Procaliber 9.6\nKey items of kit\n: Mix of Revelate & Blackburn bags, aero bars, Sea2Summit fly sheet, SOL bivvy, Macpac Firefly sleeping bag, Ground Effect & Icebreaker kit, Garmin suite of electronics, cuddly toy for long days in the saddle & a set of water wings for river crossings\nFrame type\n: Hardtail - Front Suspension\nFrame material\n: Carbon\nWheel size\n: 700c (29\")\nTyre width\n: 50mm+\nElectronic shifting\n: No\nJim Ashley\nAge\n: 999\nCap number\n: ?\nLocation\n: Wellington\nBike\n: This Year I'm cartwheeling down Te Waipounamu on the exact same setup as my last lap, with the exception of more or less everything...\nI'll be riding a dream machine Yeti ASR (29\", 120 mm front 115 mm, rear travel, 150 mm dropper) with mismatched wheels wrapped in Conti Dubnital rubber.\nKey items of kit\n: I'm carrying an eclectic collection of bags; the remarkably stable Tailfin Top tube bag is my pantry come busy drawer, my 140 g frame bag from Paper Roads mostly houses my 7Mesh rain gear, a LGTM Harness cable tied to a bent bit of metal from Get Lost holds my sleep stuff, and a wee black diamond pack carries everything else. A Way Way Harder Harness will free up both hands up the Dam(n)pier, and a Garmin 540 will be my guiding star and primary companion for this edition.\nLighting & Charging is managed by a Son 28 -> Sinewave beacon and Spurcycle bell is there for all non-verbal communication with dot watchers and ghosts.\nBring on the ICU.\nFrame type\n: MTB - Full Suspension\nFrame material\n: Carbon\nWheel size\n: 700c (29\")\nTyre width\n: 50mm+\nElectronic shifting\n: No\nMatt Dewes\nAge\n: 40\nLocation\n: Kapiti Coast, New Zealand\nBike\n: Giant XTC, 1x11, 32T front chainring, 11-46T cassette. SID Ultimate fork, Vittoria Mezcals 2.25 Tyres on carbon rims\nKey items of kit\n: Revelate Designs bags, Wayward Riders Louise harness + Ortlieb 7L dry bag, UltrAspire backpack, SOL bivvy, Cumulus sleeping bag, Garmin forerunner 955, Fenix BC26R light (on bars) and Led Lenser MH10 headtorch (mounted on helmet).\nFrame type\n: Hardtail - Front Suspension\nFrame material\n: Carbon\nWheel size\n: 700c (29\")\nTyre width\n: 45-50mm\nElectronic shifting\n: No\nGary Lindbom\nAge\n: 53\nLocation\n: Timaru, New Zealand\nBike\n: Canyon Exceed CF SLX\nKey items of kit\n: Restrap race seat bag and front bag, both 7l. Restrap frame bag. OR helium bivy, Exped synmat UL sleeping pad. Fenix BC26R front light and Fenix HM70R head torch, both using 5000mAh 21700 batteries. Wahoo Roam V3. Vittoria Mezcal 2.25 tyres\nFrame type\n: Hardtail - Front Suspension\nFrame material\n: Carbon\nWheel size\n: 700c (29\")\nTyre width\n: 50mm+\nElectronic shifting\n: Yes\nDaniel\nAge\n: 45\nBike\n: Ibis Exie 31 with Öhlins suspension, XTR drivetrain and brakes, Ergon saddle on OneUp dropper, OneUp/Deda/SQlab cockpit, Duke/Sapim/Erase/Vittoria wheels…\nKey items of kit\n: Mixed off-the-shelf bags, Wahoo/InReach/Suunto/Nitecore/Exposure electronics, Rab/Borah sleeping system, 7mesh 3-layer shell and puffer, Cafe du Cycliste shirt, Albion shorts, Fizik shoes with Ergon insoles…\nFrame type\n: MTB - Full Suspension\nFrame material\n: Carbon\nWheel size\n: 700c (29\")\nTyre width\n: 50mm+\nElectronic shifting\n: No\nWolferine\nAge\n: 43\nLocation\n: Kaikoura\nBike\n: Santa Cruz highball, painted in olive drab. Shimano 12 speed and Wheelworks hoops.\nKey items of kit\n: Bum gravey chamois cream. The rest I don't need but will definitely help get me to Slope Point.\nFrame type\n: Hardtail - Front Suspension\nFrame material\n: Carbon\nWheel size\n: 700c (29\")\nTyre width\n: 50mm+\nElectronic shifting\n: No\nEvan Caygill\nLocation\n: Christchurch\nBike\n: Giant Fathom 2023\nKey items of kit\n: Fox transfer dropper, Pro Missile aero bars, Mezcal 2.35 tires, Stealth frame bag, Tailfin top tube bag, Wayward Riders Louise dropper post harness. Bike serviced by the team at Chill.\nFrame type\n: Hardtail - Front Suspension\nFrame material\n: Aluminium\nWheel size\n: 700c (29\")\nTyre width\n: 50mm+\nElectronic shifting\n: No\nMatty King\nAge\n: 43\nLocation\n: New Plymouth NZ\nBike\n: Binary Super B, Rockshox Sid SL fork, XTR/XT drivechain/brakes, K-Lite/Son dynamo charging/lighting system, Chris King/Stans Arch wheelset, Continental RaceKing tyres, Redshift post, Salsa Bend bar 23' and Ergon Grips / Profile aerobars.\nKey items of kit\n: Garmin Edge 850, Paper Roads custom frame bag, Shimano GE900 shoes and Tineli rainwear.\nEm St John\nAge\n: 33\nLocation\n: Christchurch\nBike\n: Santa Cruz Chameleon\nKey items of kit\n: Revelate feed bags, Restrap top tube bag, Bivvy and sleeping bag and\nOrtlieb seat post bag.\nBryce Lorcet\nAge\n: 52\nLocation\n: Paraparaumu\nBike\n: Specialized Epic 8 EVO, de-evoed! Fox 34SC fork, 120mm both ends. Shimano drivetrain with no electronics, 30t chainring. Dropper post but with the short pilot I really only use it to get on and off, with a tiny bit of drop when it gets wild. Carbon 11 degree sweep bar with Ergon grips, inner bar ends and aero bars (50/50 call on that one). Taking the dynamo again but adding a powerbank for all the time that you're going too slow to charge.\nKey items of kit\n: Super reliable Revelate Designs bags all round, small and light Sea to Summit sleeping bag, SOL bivvy, self-inflating mat and a fair selection of clothing to be warm in the snow. Garmin Edge and Gaia on the phone for nav, and taking a cooker for some dehy in wild places cause I like a big meal. Taking an Ultimate Direction 12L running vest to reduce the load on the bike in the mountains, and using a home build bike carry harness.\nFrame type\n: MTB - Full Suspension\nFrame material\n: Carbon\nWheel size\n: 700c (29\")\nTyre width\n: 50mm+\nElectronic shifting\n: No\nGary Hall\nAge\n: 50\nLocation\n: Hawkes bay NZ\nBike\n: Ti Chiru Pinion Divider\nKey items of kit\n: Pinion gearbox with chain setup this time complimented with 2.6 Mezcal tires and Brooks Swallow saddle and comfy 120mm Sid fork. Ergon 2 grips and T2 aerobars .\nBivy Klymit air mattress and synthetic puffer jacket for sleeping system. Tiny fuel tablet ti mug cooker for dehydrated meals.\nFrame type\n: Hardtail - Front Suspension\nFrame material\n: Titanium\nWheel size\n: 700c (29\")\nTyre width\n: 50mm+\nElectronic shifting\n: No\nAdam Carlson\nAge\n: 48\nLocation\n: Queenstown, NZ\nBike\n: Old mate Kona Honzo 2018.\nWe’ve seen some things, we’re going to see some more.\nDynamo hub powering some Busch Mueller lights.\nShimano for going and stopping.\nMezcals for speed and efficiency.\nKey items of kit\n: Rab Bivi for sleeping well.\nStove for eating well.\nCouple of homemade bags and some bought ones.\nFrame type\n: Hardtail - Front Suspension\nFrame material\n: Aluminium\nWheel size\n: 700c (29\")\nTyre width\n: 50mm+\nElectronic shifting\n: No\nKarl Arndt\nAge\n: 45\nLocation\n: Nelson, NZ\nBike\n: Trek Stache 7.\nKey items of kit\n: The main differences between my last TTW ride and this one is that I've added front suspension and aero bars and switched to flat pedals. I've reduced weight elsewhere (sleep system, electronics, no cooker this time, etc). Still rolling a Son dynamo hub and K-Lite front light, and using Maxxis Ikons again. Taking plenty of warm clothes and extra food so I can wait out any storms or river crossings, if needed...\nFrame type\n: Hardtail - Front Suspension\nFrame material\n: Aluminium\nWheel size\n: 700c (29\")\nTyre width\n: 50mm+\nElectronic shifting\n: No\nTom Baker\nAge\n: 43\nCap number\n: Team big mouth strikes again\nLocation\n: Queenstown NZ\nBike\n: Ritchey Ascent. Steel. Fully rigid. Not quite the ideal bike for the TTW but it’s the only one I got. It’s been down the course before hopefully it remembers the way and goes a bit faster!\nKey items of kit\n: Mezcals are on now. Because mezcals. 32 tooth on the front. Have upgraded to a suspension stem and seat post. Having a long body and short legs I struggle with the seat bag hitting the rear wheel. So this year I’ve upgraded to a Tailfin Cargo Pack to eliminate this issue. Aero bars are a new addition and I don’t know what I’d do without them. Really enjoying the change in position. It’s almost a rest!\nFrame type\n: Hardtail - Fully Rigid\nFrame material\n: Steel\nWheel size\n: 700c (29\")\nTyre width\n: 50mm+\nElectronic shifting\n: No\nMartin Grethe\nAge\n: 54\nLocation\n: Wellington\nBike\n: Niner Air 9 RDO\nKey items of kit\n: Shimano XT & Absolut black Oval 32-10/46. Apidura bags & Stealth frame bag. Sleep kit/shelter: SOL bivy, Rab Siltarp - KiwiUltralight quilt & Exped mat. Nav/tracking: Wahoo Element Roam & Garmin Inreach Mini 2.\nFrame type\n: Hardtail - Front Suspension\nFrame material\n: Carbon\nWheel size\n: 700c (29\")\nTyre width\n: 50mm+\nElectronic shifting\n: No\nPhill Davies\nAge\n: 42\nLocation\n: New Plymouth\nBike\n: Binary Super Bee\nKey items of kit\n: Intend BC Samurai USD fork, We Are One wheels, 34X20 gearing, Rockgeist frame bag, Paper Roads top tube bag, Wayward Riders Saddle Harness, Thompson seat post, Specialized Power saddle and custom padded down tube for the HAB.\nFrame type\n: Hardtail - Front Suspension\nFrame material\n: Titanium\nWheel size\n: 700c (29\")\nTyre width\n: 50mm+\nElectronic shifting\n: No\nEmma Bateup\nAge\n: 26\nLocation\n: Wellington\nBike\n: Juliana Wilder with Reserve wheels wrapped in Maxxis Aspens. Burgtec grips & flat pedals (win medals). 32t chainring. OneUp dropper and pump with EDC. Wayward Riders front harness prototype (aero edition) & Silva 6l drybag, BP Bikebags top tube bag, @dirtbag.utility.co frame bag, Apidura downtube bag.\nKey items of kit\n: Ground Effect clothing. Coros Dura for nav. Silva Strive 10L vest. Hike-a-bike harness. MSR E-bivy & Therm-a-Rest Hyperion bag. Giro Tracker Fastlace shoes. Fenix BC26R light on helmet (plus a spare, I've been learning).\nFrame type\n: MTB - Full Suspension\nFrame material\n: Carbon\nWheel size\n: 700c (29\")\nTyre width\n: 50mm+\nElectronic shifting\n: No",
    "content_hash": "ca43ba70b2589a52490f4e7e03f064bfc68ea6b5fe9498d25d72a084e395662d",
    "scraped_at": "2026-02-02T06:56:04.698661+00:00",
    "url": "https://dotwatcher.cc/feature/bikes-of-tour-te-waipounamu-2026",
    "riders": [
      {
        "name": "Rufus Wenlock",
        "age": "38",
        "location": "NZ",
        "bike": "Süfur - prototype 32”",
        "key_items": "Massive frame bag made by Tailfin. This has all my clothing, sleep system and food.\nAlbion cargo vest with 2lt water + snacks + spares.\nTailfin top tube bag with all my electronics.\n750ml bottle on top tube.",
        "frame_type": "Hardtail - Front Suspension",
        "frame_material": "Steel",
        "wheel_size": "Other",
        "tyre_width": "50mm+",
        "electronic_shifting": true
      },
      {
        "name": "Sami Sauri",
        "age": "33",
        "location": "chamonix",
        "bike": "Frame : Rose bikes - PDQ hard tail",
        "key_items": "Controllers: Pod Ultimate controler\nHandlebar: flat bar + aero zipp handlebars\nSaddle: Selle San Marco Shortfit 2.0 Supercomfort\nTires: Schwalbe Racing Ralph and Racing Ray 2.35”\nPedals: Time pedals\nHammerhead device\nLight front Supernova B54 pro with battery (50+hours)\nRear light - can’t remember\nAll bags from Tailfin (white ones are custom made)",
        "frame_type": "Hardtail - Front Suspension",
        "frame_material": "Carbon",
        "wheel_size": "700c (29\")",
        "tyre_width": "50mm+",
        "electronic_shifting": true
      },
      {
        "name": "Jade Saskia Simpson-Field",
        "age": "34",
        "location": "Leeds, UK",
        "bike": "I'll be riding my Cube AMS One11 C:68 TM with a dropper, Son dynamo, k-lite front light and silly loop handlebars.",
        "key_items": "I've got my tent (Nemo Hornet Elite), sleeping bag (S2S Spark 3), mat (S2S) and PJs, as well as full water proofs and some extra warm layers. Loads of food. Hikeahike harness. Flat pedals and sandals. And NZ specifics - loads of suncream, spork for ice cream consumption and pineapple lumps!",
        "frame_type": "MTB - Full Suspension",
        "frame_material": "Carbon",
        "wheel_size": "700c (29\")",
        "tyre_width": "50mm+",
        "electronic_shifting": false
      },
      {
        "name": "Angus Young",
        "age": "29",
        "location": "Dorset, Uk",
        "bike": "Yeti ASR with Hunt wheels",
        "key_items": "Restrap bags, exposure lights (loads of them), Precision fuel and hydration, Le Col clothing.",
        "frame_type": "MTB - Full Suspension",
        "frame_material": "Carbon",
        "wheel_size": "700c (29\")",
        "tyre_width": "50mm+",
        "electronic_shifting": true
      },
      {
        "name": "Sam Horgan",
        "age": "38",
        "location": "Christchurch",
        "bike": "BMC Two Stroke AL",
        "key_items": "MLD Bivy, Sea to Summit Sleeping Bag, Thermarest Neoair Sleeping Mat.",
        "frame_type": "Hardtail - Front Suspension",
        "frame_material": "Aluminium",
        "wheel_size": "700c (29\")",
        "tyre_width": "50mm+",
        "electronic_shifting": true
      },
      {
        "name": "Jak Brightwell",
        "age": "24",
        "location": "Wellington",
        "bike": "I’ll be riding the 2018 Specialized Epic Hardtail I stole from my mum! It’s running a $17 carbon dynamo wheel I got from TradeMe hooked up to Supernova lights, Salsa bend bars with carbon aerobars, Ergon touch points (grips, saddle, and squishy seatpost), SRAM 12 speed drivetrain and new 2-pot Shimano brakes.",
        "key_items": "DansBagsTM has gone all in with a custom roll-top frame bag and stretchy top tube bag. The rear bag is held on with a Wayward riders Louise harness, and a Revelate Pronghorn up front. I’ll also be wearing a Restrap vest for extra bits. For hydration I’ve got a StudioForecast double bottle cage mount, and I’ll be navigating using a Coros Dura.",
        "frame_type": "Hardtail - Front Suspension",
        "frame_material": "Carbon",
        "wheel_size": "700c (29\")",
        "tyre_width": "50mm+",
        "electronic_shifting": false
      },
      {
        "name": "Sam Snowden",
        "age": "34",
        "location": "Te Whanganui-a-Tara / Wellington",
        "bike": "Yeti ASR",
        "key_items": "Sleep - Sea to Summit Spark / Sol Escape Bivi\nWarm - OR Synthetic\nEat - Everything",
        "frame_type": "MTB - Full Suspension",
        "frame_material": "Carbon",
        "wheel_size": "700c (29\")",
        "tyre_width": "50mm+",
        "electronic_shifting": false
      },
      {
        "name": "Mike Norman",
        "age": "57",
        "location": "Cabarita Beach, Australia",
        "bike": "Santa Cruz tall boy Dt Swiss carbon wheels, One Up dropper, Burgtec flat pedals, SRAM shifting n brakes.",
        "key_items": "Bike bag dude frame bag small bag front n rear. Sea to Summit sleeping bag, Fenix lights and Sol bivy.",
        "frame_type": "MTB - Full Suspension",
        "frame_material": "Carbon",
        "wheel_size": null,
        "tyre_width": null,
        "electronic_shifting": false
      },
      {
        "name": "Bevan Collins",
        "age": "51",
        "location": "Kerikeri, Northland, NZ",
        "bike": "Binary Bicycles SuperB XC, Shimano XTR components, kLite lights powered by a Son dynamo and 2.35 Mezcals.",
        "key_items": "Sea to Summit Traveller sleeping bag, Outdoor Research Helium Bivy, Paper Roads Aotearoa custom frame bag and Apidura bags and 2L hydration pack.",
        "frame_type": "Hardtail - Front Suspension",
        "frame_material": "Titanium",
        "wheel_size": "700c (29\")",
        "tyre_width": "50mm+",
        "electronic_shifting": true
      },
      {
        "name": "Dean Ford",
        "age": "47",
        "location": "Wellington",
        "bike": "Trek Superfly, SID 100mm forks, Wheelworks carbon wheels, Shimano XT 12-speed 30T x 10-51, Mezcal 2.35 tyres, closed-foam-taped-to-the-down-tube carry system.",
        "key_items": "Bivy, lightweight mat and sleeping bag, Fenix lights, lots of bag space for stocking up at resupply",
        "frame_type": "Hardtail - Front Suspension",
        "frame_material": "Carbon",
        "wheel_size": "700c (29\")",
        "tyre_width": "50mm+",
        "electronic_shifting": false
      },
      {
        "name": "Loic",
        "age": "27",
        "location": "Hobart . Australia",
        "bike": "Santa Cruz Highball 27.5",
        "key_items": "Big custom top tube bag by Paul, frame bag collab with Mum, flat pedals\nRekon Race front and rear 2.35, TT bars, sleeping mat and emergency bivvy and DT Swiss EX471 Rim for chunk.",
        "frame_type": "Hardtail - Front Suspension",
        "frame_material": "Carbon",
        "wheel_size": "650b (27.5\")",
        "tyre_width": "50mm+",
        "electronic_shifting": false
      },
      {
        "name": "Simon Eglinton",
        "age": "29",
        "location": "Adelaide, South Australia",
        "bike": "I'm riding a Santa Cruz Chameleon v7 with a 140mm fox 34 + transfer dropper. Groupset is a mix of 12 speed SLX and XT with 30/10-51 gearing and 4 piston stoppers. Tyres are 2.4 maxxis rekon race on sector carbon wheels. Stooge moto bars for the perfect backsweep and bucket loads of clamp area.",
        "key_items": "Nav is a coros dura. Bags are mostly revelate/miss grape il coso with a home made frame wedge, aerobar feedbag and hike-a-bike harness. Salomon 12 litre on the back. Lights are cleanskin with replaceable 18650s. Shoes are specialized recon 3.0 with the toe flex for comfy hiking. Sleep will be in an MLD bivvy, -1 bag and a cut out of closed cell foam. 3L water capacity.",
        "frame_type": "Hardtail - Front Suspension",
        "frame_material": "Aluminium",
        "wheel_size": "700c (29\")",
        "tyre_width": "50mm+",
        "electronic_shifting": false
      },
      {
        "name": "Nick Edwards",
        "age": "35",
        "location": "Melbourne, Australia",
        "bike": "Cervelo ZHT-5",
        "key_items": "Tailfin aero rack and bags , Exposure lights",
        "frame_type": "Hardtail - Front Suspension",
        "frame_material": "Carbon",
        "wheel_size": "700c (29\")",
        "tyre_width": "50mm+",
        "electronic_shifting": false
      },
      {
        "name": "Darryl Carpenter",
        "age": "60",
        "location": "Wellington",
        "bike": "Trek Procaliber 9.6",
        "key_items": "Mix of Revelate & Blackburn bags, aero bars, Sea2Summit fly sheet, SOL bivvy, Macpac Firefly sleeping bag, Ground Effect & Icebreaker kit, Garmin suite of electronics, cuddly toy for long days in the saddle & a set of water wings for river crossings",
        "frame_type": "Hardtail - Front Suspension",
        "frame_material": "Carbon",
        "wheel_size": "700c (29\")",
        "tyre_width": "50mm+",
        "electronic_shifting": false
      },
      {
        "name": "Jim Ashley",
        "age": null,
        "location": "Wellington",
        "bike": "This Year I'm cartwheeling down Te Waipounamu on the exact same setup as my last lap, with the exception of more or less everything...",
        "key_items": "I'm carrying an eclectic collection of bags; the remarkably stable Tailfin Top tube bag is my pantry come busy drawer, my 140 g frame bag from Paper Roads mostly houses my 7Mesh rain gear, a LGTM Harness cable tied to a bent bit of metal from Get Lost holds my sleep stuff, and a wee black diamond pack carries everything else. A Way Way Harder Harness will free up both hands up the Dam(n)pier, and a Garmin 540 will be my guiding star and primary companion for this edition.\nLighting & Charging is managed by a Son 28 -> Sinewave beacon and Spurcycle bell is there for all non-verbal communication with dot watchers and ghosts.\nBring on the ICU.",
        "frame_type": "MTB - Full Suspension",
        "frame_material": "Carbon",
        "wheel_size": "700c (29\")",
        "tyre_width": "50mm+",
        "electronic_shifting": false
      },
      {
        "name": "Matt Dewes",
        "age": "40",
        "location": "Kapiti Coast, New Zealand",
        "bike": "Giant XTC, 1x11, 32T front chainring, 11-46T cassette. SID Ultimate fork, Vittoria Mezcals 2.25 Tyres on carbon rims",
        "key_items": "Revelate Designs bags, Wayward Riders Louise harness + Ortlieb 7L dry bag, UltrAspire backpack, SOL bivvy, Cumulus sleeping bag, Garmin forerunner 955, Fenix BC26R light (on bars) and Led Lenser MH10 headtorch (mounted on helmet).",
        "frame_type": "Hardtail - Front Suspension",
        "frame_material": "Carbon",
        "wheel_size": "700c (29\")",
        "tyre_width": "45-50mm",
        "electronic_shifting": false
      },
      {
        "name": "Gary Lindbom",
        "age": "53",
        "location": "Timaru, New Zealand",
        "bike": "Canyon Exceed CF SLX",
        "key_items": "Restrap race seat bag and front bag, both 7l. Restrap frame bag. OR helium bivy, Exped synmat UL sleeping pad. Fenix BC26R front light and Fenix HM70R head torch, both using 5000mAh 21700 batteries. Wahoo Roam V3. Vittoria Mezcal 2.25 tyres",
        "frame_type": "Hardtail - Front Suspension",
        "frame_material": "Carbon",
        "wheel_size": "700c (29\")",
        "tyre_width": "50mm+",
        "electronic_shifting": true
      },
      {
        "name": "Daniel",
        "age": "45",
        "location": null,
        "bike": "Ibis Exie 31 with Öhlins suspension, XTR drivetrain and brakes, Ergon saddle on OneUp dropper, OneUp/Deda/SQlab cockpit, Duke/Sapim/Erase/Vittoria wheels…",
        "key_items": "Mixed off-the-shelf bags, Wahoo/InReach/Suunto/Nitecore/Exposure electronics, Rab/Borah sleeping system, 7mesh 3-layer shell and puffer, Cafe du Cycliste shirt, Albion shorts, Fizik shoes with Ergon insoles…",
        "frame_type": "MTB - Full Suspension",
        "frame_material": "Carbon",
        "wheel_size": "700c (29\")",
        "tyre_width": "50mm+",
        "electronic_shifting": false
      },
      {
        "name": "Wolferine",
        "age": "43",
        "location": "Christchurch",
        "bike": "Giant Fathom 2023",
        "key_items": "Fox transfer dropper, Pro Missile aero bars, Mezcal 2.35 tires, Stealth frame bag, Tailfin top tube bag, Wayward Riders Louise dropper post harness. Bike serviced by the team at Chill.",
        "frame_type": "Hardtail - Front Suspension",
        "frame_material": "Aluminium",
        "wheel_size": "700c (29\")",
        "tyre_width": "50mm+",
        "electronic_shifting": false
      },
      {
        "name": "Matty King",
        "age": "43",
        "location": "New Plymouth NZ",
        "bike": "Binary Super B, Rockshox Sid SL fork, XTR/XT drivechain/brakes, K-Lite/Son dynamo charging/lighting system, Chris King/Stans Arch wheelset, Continental RaceKing tyres, Redshift post, Salsa Bend bar 23' and Ergon Grips / Profile aerobars.",
        "key_items": "Garmin Edge 850, Paper Roads custom frame bag, Shimano GE900 shoes and Tineli rainwear.\nEm St John",
        "frame_type": null,
        "frame_material": null,
        "wheel_size": null,
        "tyre_width": null,
        "electronic_shifting": null
      },
      {
        "name": "Em St John",
        "age": "33",
        "location": "Christchurch",
        "bike": "Santa Cruz Chameleon",
        "key_items": "Revelate feed bags, Restrap top tube bag, Bivvy and sleeping bag and\nOrtlieb seat post bag.\nBryce Lorcet",
        "frame_type": null,
        "frame_material": null,
        "wheel_size": null,
        "tyre_width": null,
        "electronic_shifting": null
      },
      {
        "name": "Bryce Lorcet",
        "age": "52",
        "location": "Paraparaumu",
        "bike": "Specialized Epic 8 EVO, de-evoed! Fox 34SC fork, 120mm both ends. Shimano drivetrain with no electronics, 30t chainring. Dropper post but with the short pilot I really only use it to get on and off, with a tiny bit of drop when it gets wild. Carbon 11 degree sweep bar with Ergon grips, inner bar ends and aero bars (50/50 call on that one). Taking the dynamo again but adding a powerbank for all the time that you're going too slow to charge.",
        "key_items": "Super reliable Revelate Designs bags all round, small and light Sea to Summit sleeping bag, SOL bivvy, self-inflating mat and a fair selection of clothing to be warm in the snow. Garmin Edge and Gaia on the phone for nav, and taking a cooker for some dehy in wild places cause I like a big meal. Taking an Ultimate Direction 12L running vest to reduce the load on the bike in the mountains, and using a home build bike carry harness.",
        "frame_type": "MTB - Full Suspension",
        "frame_material": "Carbon",
        "wheel_size": "700c (29\")",
        "tyre_width": "50mm+",
        "electronic_shifting": false
      },
      {
        "name": "Gary Hall",
        "age": "50",
        "location": "Hawkes bay NZ",
        "bike": "Ti Chiru Pinion Divider",
        "key_items": "Pinion gearbox with chain setup this time complimented with 2.6 Mezcal tires and Brooks Swallow saddle and comfy 120mm Sid fork. Ergon 2 grips and T2 aerobars .\nBivy Klymit air mattress and synthetic puffer jacket for sleeping system. Tiny fuel tablet ti mug cooker for dehydrated meals.",
        "frame_type": "Hardtail - Front Suspension",
        "frame_material": "Titanium",
        "wheel_size": "700c (29\")",
        "tyre_width": "50mm+",
        "electronic_shifting": false
      },
      {
        "name": "Adam Carlson",
        "age": "48",
        "location": "Queenstown, NZ",
        "bike": "Old mate Kona Honzo 2018.",
        "key_items": "Rab Bivi for sleeping well.\nStove for eating well.\nCouple of homemade bags and some bought ones.",
        "frame_type": "Hardtail - Front Suspension",
        "frame_material": "Aluminium",
        "wheel_size": "700c (29\")",
        "tyre_width": "50mm+",
        "electronic_shifting": false
      },
      {
        "name": "Karl Arndt",
        "age": "45",
        "location": "Nelson, NZ",
        "bike": "Trek Stache 7.",
        "key_items": "The main differences between my last TTW ride and this one is that I've added front suspension and aero bars and switched to flat pedals. I've reduced weight elsewhere (sleep system, electronics, no cooker this time, etc). Still rolling a Son dynamo hub and K-Lite front light, and using Maxxis Ikons again. Taking plenty of warm clothes and extra food so I can wait out any storms or river crossings, if needed...",
        "frame_type": "Hardtail - Front Suspension",
        "frame_material": "Aluminium",
        "wheel_size": "700c (29\")",
        "tyre_width": "50mm+",
        "electronic_shifting": false
      },
      {
        "name": "Tom Baker",
        "age": "43",
        "location": "Queenstown NZ",
        "bike": "Ritchey Ascent. Steel. Fully rigid. Not quite the ideal bike for the TTW but it’s the only one I got. It’s been down the course before hopefully it remembers the way and goes a bit faster!",
        "key_items": "Mezcals are on now. Because mezcals. 32 tooth on the front. Have upgraded to a suspension stem and seat post. Having a long body and short legs I struggle with the seat bag hitting the rear wheel. So this year I’ve upgraded to a Tailfin Cargo Pack to eliminate this issue. Aero bars are a new addition and I don’t know what I’d do without them. Really enjoying the change in position. It’s almost a rest!",
        "frame_type": "Hardtail - Fully Rigid",
        "frame_material": "Steel",
        "wheel_size": "700c (29\")",
        "tyre_width": "50mm+",
        "electronic_shifting": false
      },
      {
        "name": "Martin Grethe",
        "age": "54",
        "location": "Wellington",
        "bike": "Niner Air 9 RDO",
        "key_items": "Shimano XT & Absolut black Oval 32-10/46. Apidura bags & Stealth frame bag. Sleep kit/shelter: SOL bivy, Rab Siltarp - KiwiUltralight quilt & Exped mat. Nav/tracking: Wahoo Element Roam & Garmin Inreach Mini 2.",
        "frame_type": "Hardtail - Front Suspension",
        "frame_material": "Carbon",
        "wheel_size": "700c (29\")",
        "tyre_width": "50mm+",
        "electronic_shifting": false
      },
      {
        "name": "Phill Davies",
        "age": "42",
        "location": "New Plymouth",
        "bike": "Binary Super Bee",
        "key_items": "Intend BC Samurai USD fork, We Are One wheels, 34X20 gearing, Rockgeist frame bag, Paper Roads top tube bag, Wayward Riders Saddle Harness, Thompson seat post, Specialized Power saddle and custom padded down tube for the HAB.",
        "frame_type": "Hardtail - Front Suspension",
        "frame_material": "Titanium",
        "wheel_size": "700c (29\")",
        "tyre_width": "50mm+",
        "electronic_shifting": false
      },
      {
        "name": "Emma Bateup",
        "age": "26",
        "location": "Wellington",
        "bike": "Juliana Wilder with Reserve wheels wrapped in Maxxis Aspens. Burgtec grips & flat pedals (win medals). 32t chainring. OneUp dropper and pump with EDC. Wayward Riders front harness prototype (aero edition) & Silva 6l drybag, BP Bikebags top tube bag, @dirtbag.utility.co frame bag, Apidura downtube bag.",
        "key_items": "Ground Effect clothing. Coros Dura for nav. Silva Strive 10L vest. Hike-a-bike harness. MSR E-bivy & Therm-a-Rest Hyperion bag. Giro Tracker Fastlace shoes. Fenix BC26R light on helmet (plus a spare, I've been learning).",
        "frame_type": "MTB - Full Suspension",
        "frame_material": "Carbon",
        "wheel_size": "700c (29\")",
        "tyre_width": "50mm+",
        "electronic_shifting": false
      }
    ]
  },
  {
    "title": "Granguanche Audax Road 2026",
    "body": "Bikes of Granguanche Audax Road 2026\n26 January, 2026\nPowered By:\nCheck out the commentary for Granguanche Audax Road 5\nTake a look at the climbing setups chosen by the riders of the 5th edition of GGAR, then take a look at our commentary\nhere\n.\nManu Cattrysse\nAge\n: 37\nCap number\n: 19\nLocation\n: Hamme, Flanders Belgium\nBike\n: I will be racing on my beloved Orbea Orca OMX, which has a full SRAM AXS Force groupset and 48-35 and 10-36 gearings. Wheels are a fresh pair of super light Hunt aerodynamicist with UD spokes and 32mm tubeless Schwalbe pro one super race tyres.\nKey items of kit\n: As always full Tailfin kit, a combination of the speedpack, toptube and wedge framebag. Lights are a Lupine Piko and Exposure diablo as Helmet light and Lezyne rear lights. For navigation i'll use a Garmin Edge Solar 1040 gps.\nFrame type\n: Road\nFrame material\n: Carbon\nWheel size\n: 700c (29\")\nTyre width\n: 30-34mm\nElectronic shifting\n: Yes\nMarcel Niemann\nAge\n: 34\nCap number\n: 45\nLocation\n: Buchen\nBike\n: Canyon Ultimate CF SL Disc 2018:\nSram RED eTap HRD (switched to 165mm Force Crank)\nHunt Carbon Wheels 50mm\n50-34 in front and 11-34 in back\nConti GP5000\nSQ-Lab saddle and pedals\nKey items of kit\n: Apidura x Canyon 5L saddle bag (down & rain jacket, arm & knee warmers, bivy) Apidura 2L top tube bag (electrics, repair and food) Salomon Hydration vest (water, ID-Card, money, meds, buff, wind vest..) Ryzon Cargo Bibs (food, smartphone) Sigma Booster and Blaze lights 2x 950ml Elite bottle Tubolito spare tubes Grmin Edge 530.\nFrame type\n: Road\nFrame material\n: Carbon\nWheel size\n: Other\nTyre width\n: 25-29mm\nElectronic shifting\n: Yes\nGeorgi Nikolov\nAge\n: 47\nCap number\n: 11\nLocation\n: Sofia, Bulgaria\nBike\n: Casati Lazer\nKey items of kit\n: Campagnolo Super Record 11 speed mechanical\n52/36-11/34\nRim brakes\nHunt Carbon UD spokes 36mm wheelset\nWahoo Bolt V2\n3T carbon cockpit\nBerk Lupina carbon saddle\nSpeedplay pedals\nTailfin top frame 1,6L and wedge frame 2,7L bags\nCastelli under saddle tools bag\nFrame type\n: Road\nFrame material\n: Steel\nWheel size\n: 700c (29\")\nTyre width\n: 25-29mm\nElectronic shifting\n: No\nCharley Wedderburn\nAge\n: 26\nCap number\n: 93\nLocation\n: London\nBike\n: Van Rysel EDR CF ULTRA\nKey items of kit\n: Yummy snacks, sunnies, lights, down jacket, spare bibs and jersey, electrolytes, inner tube etc etc\nFrame type\n: Road\nFrame material\n: Carbon\nWheel size\n: 700c (29\")\nTyre width\n: 30-34mm\nElectronic shifting\n: Yes\nJavier Ayúcar\nAge\n: 43\nCap number\n: 62\nLocation\n: Pamplona (Spain)\nBike\n: Giant Revolt 2\nKey items of kit\n: 2x10 (48/31x11/36)\nGeosmina 10l saddle bag\nAerobars (Misile pro)\n32mm tires.\nWolf-thorsten Witt\nAge\n: 60\nCap number\n: 42\nLocation\n: Eberdingen\nBike\n: Orbea Orca LTD\nKey items of kit\n: Sram Red, Sram XPLR, Zipp Handelbar, One-K Wheels, SON Dynamo/Ladelux, FIZIK Aliante 3D, Darimo Seatpost, Speedplay (Wahoo) Pedal, Quark Powermeter, Conti 5000 S TR 30 mm Tubeless Tire, Cyclite Sattelbag small, Tailfin Bags.\nFrame type\n: Road\nFrame material\n: Carbon\nWheel size\n: 700c (29\")\nTyre width\n: 30-34mm\nElectronic shifting\n: Yes\nMarcus Ruchti\nAge\n: 52\nCap number\n: 46\nLocation\n: Frankfurt\nBike\n: Trek Domane\nKey items of kit\n: SRAM Force, Apidura&Cyclite bags, Schwalbe tyres, Lupine lights\nFrame type\n: Road\nFrame material\n: Carbon\nWheel size\n: 700c (29\")\nTyre width\n: 30-34mm\nElectronic shifting\n: Yes\nMiroslav Blanarik\nAge\n: 51\nCap number\n: 76\nLocation\n: Munich\nBike\n: Cannondale Topstone 1, size XL, running on Conti 35mm Urban King, GRX 2x11 46/30 x 11/34; small changes to the original config - 180mm front disc brake rotor, a 20 years old Selle Italia Flight Flow saddle & Mavic Allroad rear wheel; Shimano XT SPD pedals.\nKey items of kit\n: AGU 3,5l frame bag, Decathlon saddle harness & dry pack combo, Decathlon 2,5l handlebar bag.\nFrame type\n: Gravel\nFrame material\n: Aluminium\nWheel size\n: 700c (29\")\nTyre width\n: 35-39mm\nElectronic shifting\n: No\nEva Berghofer\nAge\n: 48\nCap number\n: 75\nLocation\n: Austria\nBike\n: Reilly Reflex xs\nKey items of kit\n: Tailfin an cyclite bags, keego bottles, 2 food pouches, crankbrothers candy pedals, son 28 dynamo hub, sinwave beacon 2 front, son and sigma rear lights, Brooks cambium c17 carved saddle, shimano grx di2 12speed, rotor 2inpower cranks, deda superbox, deda parabolica 2 aerobars, strada 35 wheels\nFilippo Sensoli\nAge\n: 54\nLocation\n: Bike shop\nBike\n: Specialized SW tarmac SL 8\nKey items of kit\n: SRAM red\nFrame type\n: Road\nFrame material\n: Carbon\nWheel size\n: 700c (29\")\nTyre width\n: 25-29mm\nElectronic shifting\n: Yes\nFillipo's kit setup\nJon Hindley\nAge\n: 53\nCap number\n: 69\nLocation\n: Cape Town\nBike\n: Cabal Aero 2\nKey items of kit\n: Tailfin Cargo Pack\nTailfin Top Tube\nFrame type\n: Road\nFrame material\n: Carbon\nWheel size\n: 700c (29\")\nTyre width\n: 25-29mm\nElectronic shifting\n: Yes\nJan\nAge\n: 48\nCap number\n: 47\nLocation\n: Lower Saxony - Germany\nBike\n: I ride a Canyon Endurace CFR AXS in size M. Shifting is handled electronically by a SRAM Red AXS drivetrain, reliable and precise – even when the mind is already tired. I run tubeless tires, by conviction and for practical reasons: fewer worries, more focus on riding. The setup is intentionally comfortable, because over long distances it’s not the most aggressive bike that wins, but the most honest one.\nKey items of kit\n: It’s hard to say what the most important parts of my bike are. In the end, it’s probably not the drivetrain, not the frame, and not the tire pressure. The most important part is sitting on the saddle – mind, legs, and the willingness to keep going when it gets uncomfortable and the inner voice says, “stop.”\nFrame type\n: Road\nFrame material\n: Carbon\nWheel size\n: 700c (29\")\nTyre width\n: 30-34mm\nElectronic shifting\n: Yes\nAlex Caldentey\nAge\n: 32\nCap number\n: 18\nLocation\n: Mallorca\nBike\n: Tarmac Sl8 RTP\nKey items of kit\n: Minimalist aerobar, cyclite frame bag for electronics and food, zefal saddle bag for clothes, zipp bag for tools.\n50t chainring with 10/44\nFrame type\n: Road\nFrame material\n: Carbon\nWheel size\n: 700c (29\")\nTyre width\n: 25-29mm\nElectronic shifting\n: Yes\nGiovanni Frassi\nAge\n: 49\nCap number\n: 53\nLocation\n: Como, Italy\nBike\n: Specialized Tarmac\nKey items of kit\n: Missgrape bags, Hammerhead Karoo.\nMerino isadore for riding, Merino Patagonia when not on the bike, Patagonia down jacket.\nFrame type\n: Road\nFrame material\n: Carbon\nWheel size\n: 700c (29\")\nTyre width\n: 30-34mm\nElectronic shifting\n: Yes\nMarco Butti\nAge\n: 46\nCap number\n: 1051\nLocation\n: Como (Italy)\nBike\n: Specialized S-WorksTarmac SL8\nKey items of kit\n: Miss Grape bikepacking bags\n30 mm tubeless tyres\nHydration backpack with water bladder\nPuncture repair kit with two spare inner tubes\nSummer cycling kit with arm warmers, leg warmers and long-finger gloves for descents\nLightweight waterproof rain jacket\nNeck warmer for changing weather conditions\nFrame type\n: Road\nFrame material\n: Carbon\nWheel size\n: 700c (29\")\nTyre width\n: 30-34mm\nElectronic shifting\n: Yes\nJohannes\nAge\n: 31\nCap number\n: 32\nLocation\n: Stuttgart, Germany\nBike\n: Canyon Grail CF SLX\nKey items of kit\n: Shimano GRX Di2, Wheelset Shimano Ultegra C32, Lupine front light\nFrame type\n: Gravel\nFrame material\n: Carbon\nWheel size\n: 700c (29\")\nTyre width\n: 25-29mm\nElectronic shifting\n: Yes\nLukasz Marchewka\nAge\n: 42\nCap number\n: 102\nLocation\n: Krakow\nBike\n: Pinarello Dogma F\nKey items of kit\n: Ultegra Di2 8170 50/34, 11-34, with Dura-Ace rotors, and chain (graphenelube)\nZipp 303 firecrest tubeless\nFrame type\n: Road\nFrame material\n: Carbon\nWheel size\n: 700c (29\")\nTyre width\n: 25-29mm\nElectronic shifting\n: Yes\nbast Harfmann\nAge\n: 44\nCap number\n: 16\nLocation\n: Bielefeld / Germany\nBike\n: Canyon ultimate CF SLX 8 Di2 2024 size XS\nKey items of kit\n: 2x12s Ultegra Di2 paired w/ GRX RD on a wolftooth roadlink and a 10-45 XT Cassette.\nBags all from Tailfin\nDeda Jet two Aerobars mounted w/ Aeroplug adapters\nLights are 2x Garmin Varia in the back and a Supernova in front.\nStrap-on Bell from RockBros\nFrame type\n: Road\nFrame material\n: Carbon\nWheel size\n: 700c (29\")\nTyre width\n: 30-34mm\nElectronic shifting\n: Yes\nAndré Klein\nAge\n: 47\nCap number\n: 20\nLocation\n: Sankt Augustin Germany\nBike\n: BMC Roadmachine 01 DI2 Dura Ace 50/34 - 11/36(105)\nBeast handlebar, Lupine Piko light,\nKey items of kit\n: Sol Bivy, Yeti Down jacket,\nFrame type\n: Road\nFrame material\n: Carbon\nWheel size\n: 700c (29\")\nTyre width\n: 30-34mm\nElectronic shifting\n: Yes\nSander Mangelschots\nAge\n: 31\nCap number\n: 36\nLocation\n: Gent\nBike\n: Ridley - GRIFN RS (All Road Bike)\nShimano Ultegra (Compact)\nDT Swiss GRC 1400\nContinental GP5000 S TR (32mm - Tubeless)\nCoros Dura Head Unit\nExposure Strada RS MK11 Front Light\nFenix BC05R V2.0 Tail Lights (2x)\nKey items of kit\n: A shitload of gels & carb mix.\nA lot of warm / waterproof layers to fend me against the cold / wet microclimates on Gran Canaria & Tenerife. (Puffer & Rain Jacket on top of saddle bag)\nFrame type\n: Road\nFrame material\n: Carbon\nWheel size\n: 700c (29\")\nTyre width\n: 30-34mm\nElectronic shifting\n: Yes\nJan Branecki\nAge\n: 44\nCap number\n: 24\nLocation\n: Canada\nBike\n: Enve Melee\nKey items of kit\n: Tailfin, feedbag, frame pack\nFrame type\n: Road\nFrame material\n: Carbon\nWheel size\n: 700c (29\")\nTyre width\n: 30-34mm\nElectronic shifting\n: Yes\nThomas Chateau\nAge\n: 49\nCap number\n: 77\nLocation\n: Le Mans\nBike\n: FAIRLIGHT Secan 2.1 with customized Shimano GRX 44/28x11/40 and ZOLLA WHEELS. It’s the same bike I had last summer when I scratched the Transcontinental Race No11 after 2000km (I had finished it four times before), I even hasn’t changed chain and tyres. No ultra light gear list, but a complete randonneur package : I only pretend to achieve twice the race time of the incredible Audax pace. I just had to add compulsory rain pants and sea sickness pils !\nKey items of kit\n:  2015 Apidura x Rapha handlebar for  my sleep system : Katabatic Bristlecone bivy, Sea to Summit mat, Cocoon silk/thermolite liner, Pajak Radiclal X sleeping bag.\nAn Apidura x MAAP saddle bag for extra clothes (merinos warmers and long-sleeve baselayer, Café du Cycliste dyntex rain jacket, insulated jacket, gloves, socks ).\nA Tailfin frame bags for my tools, tubes, papers, medecine and electronics.\nAnd a third bottle cage.\nFrame type\n: Gravel\nFrame material\n: Steel\nWheel size\n: 700c (29\")\nTyre width\n: 40-44mm\nElectronic shifting\n: No\nBryan Bourauel\nAge\n: 28\nCap number\n: 61\nLocation\n: Germany\nBike\n: Canyon Aeroad CF SLX 7\nKey items of kit\n: Shimano 105 Di2 2x12, DT Swiss wheels, Continental Grand Prix 5000 tires (front 25 mm, back 28 mm), Ortlieb frame and seat bag, Sigma lights, Abus Gamechanger helmet, Oakley Sutro glases, Garmin Edge 1040\nFrame type\n: Road\nFrame material\n: Carbon\nWheel size\n: 700c (29\")\nTyre width\n: 25-29mm\nElectronic shifting\n: Yes\nDaniel Sander\nAge\n: 30\nCap number\n: 83\nLocation\n: Cologne\nBike\n: Canyon Endurace 8 AL. Ultegra 2x11 Mechanical shifting. Leeze Basic CC 50 Rims. Specialized Mondo 32 mm Tubeless Tires. Bontraeger Comp 360/400 mm Handlebar.\nKey items of kit\n: Restrap 7L saddle bag. Restrap toptube bag. Apidura Frame bag (4.5l). Garmin Varia rear light. Lupine SL Mono front light. Cyclite food pouches.\nFrame type\n: Road\nFrame material\n: Aluminium\nWheel size\n: 700c (29\")\nTyre width\n: 30-34mm\nElectronic shifting\n: No\nNico Mausch\nAge\n: 54\nCap number\n: 14\nLocation\n: Bad Neuenahr-Ahrweiler (Germany)\nBike\n: Specialized Tarmac SL8/2025, Shimano Ultegra Di2/52-34/11-34\nZipp303s, Conti GP 5000 S/TR Tubless Setup,\nKey items of kit\n: Mix of Cycite and Apidura Bags, Lupine AF/SL, Garmin 1040 Solar Navigation,\nMarco Luvaglia-Gori\nAge\n: 48\nCap number\n: 29\nLocation\n: Leicester\nBike\n: Giant TCR Advanced Pro 0\nUltegra DI2 52/36 - 11x34\nTailfin Cargo Pack, 0.6L Toptube Bag, 1.9L Frame Wedge Bag\n28mm GP5000\nFizik Vento Antares R3 Adaptive 3D Printed Saddle\nGarmin Varia Front and Rear Light\nKey items of kit\n: Electric Pump\nBetafuel- 1.2kilo!!,\nLecol Arc Shorts\nFrame type\n: Road\nFrame material\n: Carbon\nWheel size\n: 700c (29\")\nTyre width\n: 25-29mm\nElectronic shifting\n: Yes\nKay Ely Kuehne\nAge\n: 44\nCap number\n: 56\nLocation\n: Unterseen\nBike\n: Canyon Endurace CFR AXS\nKey items of kit\n: Apidura Racing bags, Supernova Airstream front and tail light, Garmin 1040 Solar.\nSilk undies, blister bandaids for my butt cheeks and a little wooden giraffe, to generate en-route content for my 3-year old daughter.\nFrame type\n: Road\nFrame material\n: Carbon\nWheel size\n: 700c (29\")\nTyre width\n: 30-34mm\nElectronic shifting\n: Yes\nMichał\nAge\n: 46\nCap number\n: 70\nLocation\n: Poland\nBike\n: Canion Ultimate . 30 wide tyries , sram 12 Axs 46/33 - 10/36 cassette - works for me okey considering the bike was uploaded 10 kg more then usual 😁\nKey items of kit\n: Apidura and Silca bags , 3 L weather capasity works very well. Many places to refill however this is while riding during the day at night this might be limited. Shoes - Udog gravel version works very well as i did not have other shoes with me. Roller 😝 to roll you back after exhousting day 🤪\nFrame type\n: Road\nFrame material\n: Carbon\nWheel size\n: 700c (29\")\nTyre width\n: 30-34mm\nElectronic shifting\n: Yes",
    "content_hash": "c1e57666bc48865acb4b973549741738a6036b34acab00ce5c32989e918e3c01",
    "scraped_at": "2026-02-02T06:56:05.883056+00:00",
    "url": "https://dotwatcher.cc/feature/bikes-of-granguanche-audax-road-2026",
    "riders": [
      {
        "name": "Manu Cattrysse",
        "age": "37",
        "location": "Hamme, Flanders Belgium",
        "bike": "I will be racing on my beloved Orbea Orca OMX, which has a full SRAM AXS Force groupset and 48-35 and 10-36 gearings. Wheels are a fresh pair of super light Hunt aerodynamicist with UD spokes and 32mm tubeless Schwalbe pro one super race tyres.",
        "key_items": "As always full Tailfin kit, a combination of the speedpack, toptube and wedge framebag. Lights are a Lupine Piko and Exposure diablo as Helmet light and Lezyne rear lights. For navigation i'll use a Garmin Edge Solar 1040 gps.",
        "frame_type": "Road",
        "frame_material": "Carbon",
        "wheel_size": "700c (29\")",
        "tyre_width": "30-34mm",
        "electronic_shifting": true
      },
      {
        "name": "Marcel Niemann",
        "age": "34",
        "location": "Buchen",
        "bike": "Canyon Ultimate CF SL Disc 2018:",
        "key_items": "Apidura x Canyon 5L saddle bag (down & rain jacket, arm & knee warmers, bivy) Apidura 2L top tube bag (electrics, repair and food) Salomon Hydration vest (water, ID-Card, money, meds, buff, wind vest..) Ryzon Cargo Bibs (food, smartphone) Sigma Booster and Blaze lights 2x 950ml Elite bottle Tubolito spare tubes Grmin Edge 530.",
        "frame_type": "Road",
        "frame_material": "Carbon",
        "wheel_size": "Other",
        "tyre_width": "25-29mm",
        "electronic_shifting": true
      },
      {
        "name": "Georgi Nikolov",
        "age": "47",
        "location": "Sofia, Bulgaria",
        "bike": "Casati Lazer",
        "key_items": "Campagnolo Super Record 11 speed mechanical\n52/36-11/34\nRim brakes\nHunt Carbon UD spokes 36mm wheelset\nWahoo Bolt V2\n3T carbon cockpit\nBerk Lupina carbon saddle\nSpeedplay pedals\nTailfin top frame 1,6L and wedge frame 2,7L bags\nCastelli under saddle tools bag",
        "frame_type": "Road",
        "frame_material": "Steel",
        "wheel_size": "700c (29\")",
        "tyre_width": "25-29mm",
        "electronic_shifting": false
      },
      {
        "name": "Charley Wedderburn",
        "age": "26",
        "location": "London",
        "bike": "Van Rysel EDR CF ULTRA",
        "key_items": "Yummy snacks, sunnies, lights, down jacket, spare bibs and jersey, electrolytes, inner tube etc etc",
        "frame_type": "Road",
        "frame_material": "Carbon",
        "wheel_size": "700c (29\")",
        "tyre_width": "30-34mm",
        "electronic_shifting": true
      },
      {
        "name": "Javier Ayúcar",
        "age": "43",
        "location": "Pamplona (Spain)",
        "bike": "Giant Revolt 2",
        "key_items": "2x10 (48/31x11/36)\nGeosmina 10l saddle bag\nAerobars (Misile pro)\n32mm tires.\nWolf-thorsten Witt",
        "frame_type": null,
        "frame_material": null,
        "wheel_size": null,
        "tyre_width": null,
        "electronic_shifting": null
      },
      {
        "name": "Wolf-thorsten Witt",
        "age": "60",
        "location": "Eberdingen",
        "bike": "Orbea Orca LTD",
        "key_items": "Sram Red, Sram XPLR, Zipp Handelbar, One-K Wheels, SON Dynamo/Ladelux, FIZIK Aliante 3D, Darimo Seatpost, Speedplay (Wahoo) Pedal, Quark Powermeter, Conti 5000 S TR 30 mm Tubeless Tire, Cyclite Sattelbag small, Tailfin Bags.",
        "frame_type": "Road",
        "frame_material": "Carbon",
        "wheel_size": "700c (29\")",
        "tyre_width": "30-34mm",
        "electronic_shifting": true
      },
      {
        "name": "Marcus Ruchti",
        "age": "52",
        "location": "Frankfurt",
        "bike": "Trek Domane",
        "key_items": "SRAM Force, Apidura&Cyclite bags, Schwalbe tyres, Lupine lights",
        "frame_type": "Road",
        "frame_material": "Carbon",
        "wheel_size": "700c (29\")",
        "tyre_width": "30-34mm",
        "electronic_shifting": true
      },
      {
        "name": "Miroslav Blanarik",
        "age": "51",
        "location": "Munich",
        "bike": "Cannondale Topstone 1, size XL, running on Conti 35mm Urban King, GRX 2x11 46/30 x 11/34; small changes to the original config - 180mm front disc brake rotor, a 20 years old Selle Italia Flight Flow saddle & Mavic Allroad rear wheel; Shimano XT SPD pedals.",
        "key_items": "AGU 3,5l frame bag, Decathlon saddle harness & dry pack combo, Decathlon 2,5l handlebar bag.",
        "frame_type": "Gravel",
        "frame_material": "Aluminium",
        "wheel_size": "700c (29\")",
        "tyre_width": "35-39mm",
        "electronic_shifting": false
      },
      {
        "name": "Eva Berghofer",
        "age": "48",
        "location": "Austria",
        "bike": "Reilly Reflex xs",
        "key_items": "Tailfin an cyclite bags, keego bottles, 2 food pouches, crankbrothers candy pedals, son 28 dynamo hub, sinwave beacon 2 front, son and sigma rear lights, Brooks cambium c17 carved saddle, shimano grx di2 12speed, rotor 2inpower cranks, deda superbox, deda parabolica 2 aerobars, strada 35 wheels\nFilippo Sensoli",
        "frame_type": null,
        "frame_material": null,
        "wheel_size": null,
        "tyre_width": null,
        "electronic_shifting": null
      },
      {
        "name": "Filippo Sensoli",
        "age": "54",
        "location": "Bike shop",
        "bike": "Specialized SW tarmac SL 8",
        "key_items": "SRAM red",
        "frame_type": "Road",
        "frame_material": "Carbon",
        "wheel_size": "700c (29\")",
        "tyre_width": "25-29mm",
        "electronic_shifting": true
      },
      {
        "name": "Jon Hindley",
        "age": "53",
        "location": "Cape Town",
        "bike": "Cabal Aero 2",
        "key_items": "Tailfin Cargo Pack\nTailfin Top Tube",
        "frame_type": "Road",
        "frame_material": "Carbon",
        "wheel_size": "700c (29\")",
        "tyre_width": "25-29mm",
        "electronic_shifting": true
      },
      {
        "name": "Jan",
        "age": "48",
        "location": "Lower Saxony - Germany",
        "bike": "I ride a Canyon Endurace CFR AXS in size M. Shifting is handled electronically by a SRAM Red AXS drivetrain, reliable and precise – even when the mind is already tired. I run tubeless tires, by conviction and for practical reasons: fewer worries, more focus on riding. The setup is intentionally comfortable, because over long distances it’s not the most aggressive bike that wins, but the most honest one.",
        "key_items": "It’s hard to say what the most important parts of my bike are. In the end, it’s probably not the drivetrain, not the frame, and not the tire pressure. The most important part is sitting on the saddle – mind, legs, and the willingness to keep going when it gets uncomfortable and the inner voice says, “stop.”",
        "frame_type": "Road",
        "frame_material": "Carbon",
        "wheel_size": "700c (29\")",
        "tyre_width": "30-34mm",
        "electronic_shifting": true
      },
      {
        "name": "Alex Caldentey",
        "age": "32",
        "location": "Mallorca",
        "bike": "Tarmac Sl8 RTP",
        "key_items": "Minimalist aerobar, cyclite frame bag for electronics and food, zefal saddle bag for clothes, zipp bag for tools.\n50t chainring with 10/44",
        "frame_type": "Road",
        "frame_material": "Carbon",
        "wheel_size": "700c (29\")",
        "tyre_width": "25-29mm",
        "electronic_shifting": true
      },
      {
        "name": "Giovanni Frassi",
        "age": "49",
        "location": "Como, Italy",
        "bike": "Specialized Tarmac",
        "key_items": "Missgrape bags, Hammerhead Karoo.\nMerino isadore for riding, Merino Patagonia when not on the bike, Patagonia down jacket.",
        "frame_type": "Road",
        "frame_material": "Carbon",
        "wheel_size": "700c (29\")",
        "tyre_width": "30-34mm",
        "electronic_shifting": true
      },
      {
        "name": "Marco Butti",
        "age": "46",
        "location": "Como (Italy)",
        "bike": "Specialized S-WorksTarmac SL8",
        "key_items": "Miss Grape bikepacking bags\n30 mm tubeless tyres\nHydration backpack with water bladder\nPuncture repair kit with two spare inner tubes\nSummer cycling kit with arm warmers, leg warmers and long-finger gloves for descents\nLightweight waterproof rain jacket\nNeck warmer for changing weather conditions",
        "frame_type": "Road",
        "frame_material": "Carbon",
        "wheel_size": "700c (29\")",
        "tyre_width": "30-34mm",
        "electronic_shifting": true
      },
      {
        "name": "Johannes",
        "age": "31",
        "location": "Stuttgart, Germany",
        "bike": "Canyon Grail CF SLX",
        "key_items": "Shimano GRX Di2, Wheelset Shimano Ultegra C32, Lupine front light",
        "frame_type": "Gravel",
        "frame_material": "Carbon",
        "wheel_size": "700c (29\")",
        "tyre_width": "25-29mm",
        "electronic_shifting": true
      },
      {
        "name": "Lukasz Marchewka",
        "age": "42",
        "location": "Krakow",
        "bike": "Pinarello Dogma F",
        "key_items": "Ultegra Di2 8170 50/34, 11-34, with Dura-Ace rotors, and chain (graphenelube)\nZipp 303 firecrest tubeless",
        "frame_type": "Road",
        "frame_material": "Carbon",
        "wheel_size": "700c (29\")",
        "tyre_width": "25-29mm",
        "electronic_shifting": true
      },
      {
        "name": "bast Harfmann",
        "age": "44",
        "location": "Bielefeld / Germany",
        "bike": "Canyon ultimate CF SLX 8 Di2 2024 size XS",
        "key_items": "2x12s Ultegra Di2 paired w/ GRX RD on a wolftooth roadlink and a 10-45 XT Cassette.\nBags all from Tailfin\nDeda Jet two Aerobars mounted w/ Aeroplug adapters\nLights are 2x Garmin Varia in the back and a Supernova in front.\nStrap-on Bell from RockBros",
        "frame_type": "Road",
        "frame_material": "Carbon",
        "wheel_size": "700c (29\")",
        "tyre_width": "30-34mm",
        "electronic_shifting": true
      },
      {
        "name": "André Klein",
        "age": "47",
        "location": "Sankt Augustin Germany",
        "bike": "BMC Roadmachine 01 DI2 Dura Ace 50/34 - 11/36(105)",
        "key_items": "Sol Bivy, Yeti Down jacket,",
        "frame_type": "Road",
        "frame_material": "Carbon",
        "wheel_size": "700c (29\")",
        "tyre_width": "30-34mm",
        "electronic_shifting": true
      },
      {
        "name": "Sander Mangelschots",
        "age": "31",
        "location": "Gent",
        "bike": "Ridley - GRIFN RS (All Road Bike)",
        "key_items": "A shitload of gels & carb mix.\nA lot of warm / waterproof layers to fend me against the cold / wet microclimates on Gran Canaria & Tenerife. (Puffer & Rain Jacket on top of saddle bag)",
        "frame_type": "Road",
        "frame_material": "Carbon",
        "wheel_size": "700c (29\")",
        "tyre_width": "30-34mm",
        "electronic_shifting": true
      },
      {
        "name": "Jan Branecki",
        "age": "44",
        "location": "Canada",
        "bike": "Enve Melee",
        "key_items": "Tailfin, feedbag, frame pack",
        "frame_type": "Road",
        "frame_material": "Carbon",
        "wheel_size": "700c (29\")",
        "tyre_width": "30-34mm",
        "electronic_shifting": true
      },
      {
        "name": "Thomas Chateau",
        "age": "49",
        "location": "Le Mans",
        "bike": "FAIRLIGHT Secan 2.1 with customized Shimano GRX 44/28x11/40 and ZOLLA WHEELS. It’s the same bike I had last summer when I scratched the Transcontinental Race No11 after 2000km (I had finished it four times before), I even hasn’t changed chain and tyres. No ultra light gear list, but a complete randonneur package : I only pretend to achieve twice the race time of the incredible Audax pace. I just had to add compulsory rain pants and sea sickness pils !",
        "key_items": "2015 Apidura x Rapha handlebar for  my sleep system : Katabatic Bristlecone bivy, Sea to Summit mat, Cocoon silk/thermolite liner, Pajak Radiclal X sleeping bag.\nAn Apidura x MAAP saddle bag for extra clothes (merinos warmers and long-sleeve baselayer, Café du Cycliste dyntex rain jacket, insulated jacket, gloves, socks ).\nA Tailfin frame bags for my tools, tubes, papers, medecine and electronics.\nAnd a third bottle cage.",
        "frame_type": "Gravel",
        "frame_material": "Steel",
        "wheel_size": "700c (29\")",
        "tyre_width": "40-44mm",
        "electronic_shifting": false
      },
      {
        "name": "Bryan Bourauel",
        "age": "28",
        "location": "Germany",
        "bike": "Canyon Aeroad CF SLX 7",
        "key_items": "Shimano 105 Di2 2x12, DT Swiss wheels, Continental Grand Prix 5000 tires (front 25 mm, back 28 mm), Ortlieb frame and seat bag, Sigma lights, Abus Gamechanger helmet, Oakley Sutro glases, Garmin Edge 1040",
        "frame_type": "Road",
        "frame_material": "Carbon",
        "wheel_size": "700c (29\")",
        "tyre_width": "25-29mm",
        "electronic_shifting": true
      },
      {
        "name": "Daniel Sander",
        "age": "30",
        "location": "Cologne",
        "bike": "Canyon Endurace 8 AL. Ultegra 2x11 Mechanical shifting. Leeze Basic CC 50 Rims. Specialized Mondo 32 mm Tubeless Tires. Bontraeger Comp 360/400 mm Handlebar.",
        "key_items": "Restrap 7L saddle bag. Restrap toptube bag. Apidura Frame bag (4.5l). Garmin Varia rear light. Lupine SL Mono front light. Cyclite food pouches.",
        "frame_type": "Road",
        "frame_material": "Aluminium",
        "wheel_size": "700c (29\")",
        "tyre_width": "30-34mm",
        "electronic_shifting": false
      },
      {
        "name": "Nico Mausch",
        "age": "54",
        "location": "Bad Neuenahr-Ahrweiler (Germany)",
        "bike": "Specialized Tarmac SL8/2025, Shimano Ultegra Di2/52-34/11-34",
        "key_items": "Mix of Cycite and Apidura Bags, Lupine AF/SL, Garmin 1040 Solar Navigation,\nMarco Luvaglia-Gori",
        "frame_type": null,
        "frame_material": null,
        "wheel_size": null,
        "tyre_width": null,
        "electronic_shifting": null
      },
      {
        "name": "Marco Luvaglia-Gori",
        "age": "48",
        "location": "Leicester",
        "bike": "Giant TCR Advanced Pro 0",
        "key_items": "Electric Pump\nBetafuel- 1.2kilo!!,\nLecol Arc Shorts",
        "frame_type": "Road",
        "frame_material": "Carbon",
        "wheel_size": "700c (29\")",
        "tyre_width": "25-29mm",
        "electronic_shifting": true
      },
      {
        "name": "Kay Ely Kuehne",
        "age": "44",
        "location": "Unterseen",
        "bike": "Canyon Endurace CFR AXS",
        "key_items": "Apidura Racing bags, Supernova Airstream front and tail light, Garmin 1040 Solar.\nSilk undies, blister bandaids for my butt cheeks and a little wooden giraffe, to generate en-route content for my 3-year old daughter.",
        "frame_type": "Road",
        "frame_material": "Carbon",
        "wheel_size": "700c (29\")",
        "tyre_width": "30-34mm",
        "electronic_shifting": true
      },
      {
        "name": "Michał",
        "age": "46",
        "location": "Poland",
        "bike": "Canion Ultimate . 30 wide tyries , sram 12 Axs 46/33 - 10/36 cassette - works for me okey considering the bike was uploaded 10 kg more then usual 😁",
        "key_items": "Apidura and Silca bags , 3 L weather capasity works very well. Many places to refill however this is while riding during the day at night this might be limited. Shoes - Udog gravel version works very well as i did not have other shoes with me. Roller 😝 to roll you back after exhousting day 🤪",
        "frame_type": "Road",
        "frame_material": "Carbon",
        "wheel_size": "700c (29\")",
        "tyre_width": "30-34mm",
        "electronic_shifting": true
      }
    ]
  }
]